{
  "$schema": "http://json-schema.org/draft-07/schema#",
  "$id": "https://beaconpave/quality/verdicts/schema.json",
  "title": "Verdict Record",
  "description": "The single contract every quality runner emits \u2014 agent evals, Playwright, k6, drills. One schema is what makes company-wide regression-risk and defect-leakage dashboards possible.",
  "type": "object",
  "additionalProperties": false,
  "required": [
    "service",
    "surface",
    "commit",
    "suite",
    "layer",
    "verdict",
    "fail_closed"
  ],
  "properties": {
    "service": {
      "type": "string",
      "description": "e.g. highlights-agent"
    },
    "surface": {
      "type": "string",
      "enum": [
        "backend",
        "web",
        "mobile",
        "data",
        "stream"
      ],
      "description": "Which surface produced this verdict"
    },
    "commit": {
      "type": "string",
      "description": "git SHA under test"
    },
    "suite": {
      "type": "string",
      "description": "e.g. evals, contract, playwright, k6, drill"
    },
    "layer": {
      "type": "string",
      "enum": [
        "L0",
        "L1",
        "L2",
        "L3",
        "L4",
        "L5"
      ],
      "description": "Test pyramid layer"
    },
    "verdict": {
      "type": "string",
      "enum": [
        "PASS",
        "FAIL",
        "ADVISORY",
        "INFRA"
      ],
      "description": "INFRA = probe/harness infrastructure failed, not the code under test; pages the platform, not the team"
    },
    "fail_closed": {
      "type": "boolean",
      "description": "True if an errored gate blocked (G2). Must be true for any blocking suite."
    },
    "scores": {
      "type": "object",
      "description": "Metric name -> value in [0,1] or raw measure",
      "additionalProperties": {
        "type": "number"
      }
    },
    "baseline_diff": {
      "type": "object",
      "description": "Metric name -> delta vs committed baseline (negative = regression)",
      "additionalProperties": {
        "type": "number"
      }
    },
    "flake_score": {
      "type": "number",
      "description": "Re-run variance [0,1]; above threshold auto-quarantines the suite to advisory and pages its owner"
    },
    "tokens_in": {
      "type": "number",
      "description": "Input tokens consumed; the blocking budget dimension (ADR-014)"
    },
    "tokens_out": {
      "type": "number",
      "description": "Output tokens produced; the blocking budget dimension (ADR-014)"
    },
    "cost_usd": {
      "type": "number",
      "description": "Reported cost, rendered from tokens at the pinned regional rate (ADR-014, ADR-015). Reporting only \u2014 a gate never blocks on this, because a vendor price change would then move a verdict with no code change. Budget regressions block on tokens_in/tokens_out."
    },
    "duration_s": {
      "type": "number"
    },
    "provenance": {
      "type": "object",
      "additionalProperties": false,
      "properties": {
        "author": {
          "type": "string",
          "enum": [
            "human",
            "ai-proposed"
          ]
        },
        "curated_by": {
          "type": "string"
        }
      }
    },
    "artifacts": {
      "type": "array",
      "items": {
        "type": "string"
      },
      "description": "S3 URIs or paths to detailed logs / audit-lake records"
    },
    "notes": {
      "type": "array",
      "items": {
        "type": "string"
      },
      "description": "Human-facing lines explaining what this suite decided and why, produced by the runner. **The gate renders them into the pull-request comment; nothing parses them, and no decision may ever be taken from them.** Claim 2 is `gates fail closed AND teach`, and until M04 the teaching half lived only in a CI log: the lane printed which probe moved and in which direction, the verdict recorded `FAIL`, and the reviewer got a red check with no way to see the difference without opening the run. A finding that travels with the artifact is one a reader still has next milestone; a finding in a log is one that expires with the retention policy. Keep each line short enough to read in a comment and specific enough to act on - `ADV-002 FAIL -> PASS, above the pinned 6/10` rather than `the adversarial suite regressed`."
    }
  }
}
